{
  "image_id": "ARMS/000",
  "method": "classical_baseline",
  "algorithm": "telea",
  "model_repository": null,
  "experiment_id": "fixture-experiment",
  "input_image_path": "D:\\Work\\DIP\\manga-text-segmentation-translation\\.pytest-audit-run\\test_radius_and_format_come_fr0\\synthetic-raw-1\\ARMS\\000.png",
  "prediction_mask_path": "D:\\Work\\DIP\\manga-text-segmentation-translation\\.pytest-audit-run\\test_radius_and_format_come_fr0\\inpaint-fixture-1\\masks\\ARMS\\000.png",
  "mask_size": [
    1654,
    1170
  ],
  "alignment": {
    "rule": "pass-through",
    "pre_size": [
      1654,
      1170
    ],
    "post_size": [
      1654,
      1170
    ]
  },
  "dilation": {
    "enabled": true,
    "kernel_shape": "ellipse",
    "kernel_size": [
      3,
      3
    ],
    "iterations": 1
  },
  "inpaint_algorithm": "INPAINT_TELEA",
  "inpaint_radius": 5,
  "output_format": "png",
  "processing_time_seconds": 0.026823000007425435,
  "status": "ok",
  "error_message": null
}
