{
  "image_id": "ARMS/000",
  "method": "classical_baseline",
  "algorithm": "telea",
  "model_repository": null,
  "experiment_id": "translation-fixture",
  "input_image_path": "D:\\Work\\DIP\\manga-text-segmentation-translation\\.pytest-audit-integration\\test_region_and_page_reruns_re0\\translation-bundle-ARMS-000-0\\raw\\ARMS\\000.png",
  "prediction_mask_path": "D:\\Work\\DIP\\manga-text-segmentation-translation\\.pytest-audit-integration\\test_region_and_page_reruns_re0\\spec2\\masks\\ARMS\\000.png",
  "mask_size": [
    1654,
    1170
  ],
  "alignment": {
    "rule": "pass-through",
    "pre_size": [
      1654,
      1170
    ],
    "post_size": [
      1654,
      1170
    ]
  },
  "dilation": {
    "enabled": false
  },
  "inpaint_algorithm": "INPAINT_TELEA",
  "inpaint_radius": 3.0,
  "output_format": "png",
  "processing_time_seconds": 0.0,
  "status": "ok"
}
